<?xml version="1.0" encoding="UTF-8"?>
<birken xmlns:xsi="http://www.w3.org/2001/XMLSchema-instance"
        xsi:noNamespaceSchemaLocation="birken-paamelding.xsd">

   <!-- Puljer -->
   <puljer>
      <pulje pId="1" startTid="2026-03-15T08:00:00"/>
      <pulje pId="2" startTid="2026-03-15T08:30:00"/>
      <pulje pId="3" startTid="2026-03-15T09:00:00"/>
      <pulje pId="4" startTid="2026-03-15T09:30:00"/>
      <pulje pId="5" startTid="2026-03-15T10:00:00"/>
   </puljer>

   <!-- Påmeldte personer -->
   <person>
      <!-- Foresatt -->
      <id>h0001</id>
      <navn>Lasse Jenssen</navn>
      <fdato>1983-05-12</fdato>
      <fnr>12058348217</fnr>
      <medlem>true</medlem>
      <poeng>1200.01</poeng>
      <hjemmeside>https://www.jcon.no/blog</hjemmeside>
      <puljeId>2</puljeId>
   </person>

   <person>
      <!-- Foresatt -->
      <id>h0002</id>
      <navn>Ola Hansen</navn>
      <fdato>1975-03-06</fdato>
      <fnr>06037515940</fnr>
      <medlem>true</medlem>
      <poeng>1405.21</poeng>
      <hjemmeside>https://www.olahansen.no</hjemmeside>
      <puljeId>1</puljeId>
   </person>

   <!-- Barn under 16 år -->
   <person>
      <id>d0005</id>
      <navn>Nora Jenssen</navn>
      <fdato>2012-12-02</fdato>
      <fnr>02121250683</fnr>
      <medlem>false</medlem>
      <poeng>621.23</poeng>
      <hjemmeside>https://www.jenssen.no/nora</hjemmeside>
      <puljeId>5</puljeId>
      <foresattId>h0001</foresattId>
   </person>

   <!-- 20 nye herrer (h0003-h0022) -->
   <person>
      <id>h0003</id>
      <navn>Jonas Berg</navn>
      <fdato>1988-01-14</fdato>
      <fnr>14018883725</fnr>
      <medlem>true</medlem>
      <poeng>980.12</poeng>
      <hjemmeside>https://example.com/jonas-berg</hjemmeside>
      <puljeId>2</puljeId>
   </person>
   <person>
      <id>h0004</id>
      <navn>Mats Lunde</navn>
      <fdato>1990-04-21</fdato>
      <fnr>21049019357</fnr>
      <medlem>false</medlem>
      <poeng>765.33</poeng>
      <hjemmeside>https://example.com/mats-lunde</hjemmeside>
      <puljeId>3</puljeId>
   </person>
   <person>
      <id>h0005</id>
      <navn>Thomas Engen</navn>
      <fdato>1988-05-03</fdato>
      <fnr>03058862491</fnr>
      <medlem>true</medlem>
      <poeng>905.20</poeng>
      <hjemmeside>https://example.com/thomas-engen</hjemmeside>
      <puljeId>2</puljeId>
   </person>
   <person>
      <id>h0006</id>
      <navn>Henrik Aas</navn>
      <fdato>1982-11-05</fdato>
      <fnr>05118228530</fnr>
      <medlem>true</medlem>
      <poeng>1105.44</poeng>
      <hjemmeside>https://example.com/henrik-aas</hjemmeside>
      <puljeId>1</puljeId>
   </person>
   <person>
      <id>h0007</id>
      <navn>Anders Lie</navn>
      <fdato>1979-09-18</fdato>
      <fnr>18097959372</fnr>
      <medlem>false</medlem>
      <poeng>845.67</poeng>
      <hjemmeside>https://example.com/anders-lie</hjemmeside>
      <puljeId>2</puljeId>
   </person>
   <person>
      <id>h0008</id>
      <navn>Kristoffer Moe</navn>
      <fdato>1995-02-10</fdato>
      <fnr>10029528463</fnr>
      <medlem>true</medlem>
      <poeng>930.22</poeng>
      <hjemmeside>https://example.com/kristoffer-moe</hjemmeside>
      <puljeId>4</puljeId>
   </person>
   <person>
      <id>h0009</id>
      <navn>Sindre Johansen</navn>
      <fdato>1986-07-29</fdato>
      <fnr>29078613504</fnr>
      <medlem>true</medlem>
      <poeng>1010.50</poeng>
      <hjemmeside>https://example.com/sindre-johansen</hjemmeside>
      <puljeId>2</puljeId>
   </person>
   <person>
      <id>h0010</id>
      <navn>Emil Røed</navn>
      <fdato>1992-03-12</fdato>
      <fnr>12039202758</fnr>
      <medlem>false</medlem>
      <poeng>720.84</poeng>
      <hjemmeside>https://example.com/emil-rod</hjemmeside>
      <puljeId>3</puljeId>
   </person>
   <person>
      <id>h0011</id>
      <navn>Vetle Skaar</navn>
      <fdato>1984-05-22</fdato>
      <fnr>22058455370</fnr>
      <medlem>true</medlem>
      <poeng>990.77</poeng>
      <hjemmeside>https://example.com/vetle-skaar</hjemmeside>
      <puljeId>1</puljeId>
   </person>
   <person>
      <id>h0012</id>
      <navn>Trym Eide</navn>
      <fdato>1981-10-09</fdato>
      <fnr>09108118065</fnr>
      <medlem>false</medlem>
      <poeng>800.12</poeng>
      <hjemmeside>https://example.com/trym-eide</hjemmeside>
      <puljeId>2</puljeId>
   </person>
   <person>
      <id>h0013</id>
      <navn>Leif Knutsen</navn>
      <fdato>1977-08-16</fdato>
      <fnr>16087720793</fnr>
      <medlem>true</medlem>
      <poeng>1055.66</poeng>
      <hjemmeside>https://example.com/leif-knutsen</hjemmeside>
      <puljeId>1</puljeId>
   </person>
   <person>
      <id>h0014</id>
      <navn>Petter Dahl</navn>
      <fdato>1993-06-03</fdato>
      <fnr>03069396218</fnr>
      <medlem>false</medlem>
      <poeng>760.42</poeng>
      <hjemmeside>https://example.com/petter-dahl</hjemmeside>
      <puljeId>3</puljeId>
   </person>
   <person>
      <id>h0015</id>
      <navn>Jørgen Hauge</navn>
      <fdato>1989-12-24</fdato>
      <fnr>24128953601</fnr>
      <medlem>true</medlem>
      <poeng>1005.90</poeng>
      <hjemmeside>https://example.com/jorgen-hauge</hjemmeside>
      <puljeId>2</puljeId>
   </person>
   <person>
      <id>h0016</id>
      <navn>Eirik Tangen</navn>
      <fdato>1987-02-27</fdato>
      <fnr>27028704215</fnr>
      <medlem>false</medlem>
      <poeng>835.13</poeng>
      <hjemmeside>https://example.com/eirik-tangen</hjemmeside>
      <puljeId>3</puljeId>
   </person>
   <person>
      <id>h0017</id>
      <navn>Sigurd Vik</navn>
      <fdato>1980-01-30</fdato>
      <fnr>30018075624</fnr>
      <medlem>true</medlem>
      <poeng>1120.88</poeng>
      <hjemmeside>https://example.com/sigurd-vik</hjemmeside>
      <puljeId>1</puljeId>
   </person>
   <person>
      <id>h0018</id>
      <navn>Filip Nymoen</navn>
      <fdato>1996-09-11</fdato>
      <fnr>11099669458</fnr>
      <medlem>false</medlem>
      <poeng>745.25</poeng>
      <hjemmeside>https://example.com/filip-nymoen</hjemmeside>
      <puljeId>4</puljeId>
   </person>
   <person>
      <id>h0019</id>
      <navn>Ulrik Foss</navn>
      <fdato>1978-04-07</fdato>
      <fnr>07047848516</fnr>
      <medlem>true</medlem>
      <poeng>990.31</poeng>
      <hjemmeside>https://example.com/ulrik-foss</hjemmeside>
      <puljeId>2</puljeId>
   </person>
   <person>
      <id>h0020</id>
      <navn>Ruben Sand</navn>
      <fdato>1991-11-19</fdato>
      <fnr>19119119832</fnr>
      <medlem>false</medlem>
      <poeng>780.64</poeng>
      <hjemmeside>https://example.com/ruben-sand</hjemmeside>
      <puljeId>3</puljeId>
   </person>
   <person>
      <id>h0021</id>
      <navn>Kristian Lund</navn>
      <fdato>1985-03-23</fdato>
      <fnr>23038576014</fnr>
      <medlem>true</medlem>
      <poeng>1025.47</poeng>
      <hjemmeside>https://example.com/kristian-lund</hjemmeside>
      <puljeId>1</puljeId>
   </person>
   <person>
      <id>h0022</id>
      <navn>Kenneth Myhre</navn>
      <fdato>1983-07-02</fdato>
      <fnr>02078316275</fnr>
      <medlem>false</medlem>
      <poeng>850.76</poeng>
      <hjemmeside>https://example.com/kenneth-myhre</hjemmeside>
      <puljeId>2</puljeId>
   </person>

   <!-- 20 nye damer (d0006-d0025) -->
   <person>
      <id>d0006</id>
      <navn>Marie Solberg</navn>
      <fdato>1994-02-08</fdato>
      <fnr>08029472613</fnr>
      <medlem>true</medlem>
      <poeng>970.33</poeng>
      <hjemmeside>https://example.com/marie-solberg</hjemmeside>
      <puljeId>4</puljeId>
   </person>
   <person>
      <id>d0007</id>
      <navn>Silje Haug</navn>
      <fdato>1990-10-15</fdato>
      <fnr>15109001349</fnr>
      <medlem>false</medlem>
      <poeng>720.22</poeng>
      <hjemmeside>https://example.com/silje-haug</hjemmeside>
      <puljeId>3</puljeId>
   </person>
   <person>
      <id>d0008</id>
      <navn>Line Karlsen</navn>
      <fdato>1988-06-19</fdato>
      <fnr>19068885403</fnr>
      <medlem>true</medlem>
      <poeng>990.55</poeng>
      <hjemmeside>https://example.com/line-karlsen</hjemmeside>
      <puljeId>2</puljeId>
   </person>
   <person>
      <id>d0009</id>
      <navn>Nora Vik</navn>
      <fdato>1995-11-30</fdato>
      <fnr>30119551327</fnr>
      <medlem>false</medlem>
      <poeng>740.68</poeng>
      <hjemmeside>https://example.com/nora-vik</hjemmeside>
      <puljeId>3</puljeId>
   </person>
   <person>
      <id>d0010</id>
      <navn>Tuva Nilsen</navn>
      <fdato>1992-01-05</fdato>
      <fnr>05019213598</fnr>
      <medlem>true</medlem>
      <poeng>950.10</poeng>
      <hjemmeside>https://example.com/tuva-nilsen</hjemmeside>
      <puljeId>4</puljeId>
   </person>
   <person>
      <id>d0011</id>
      <navn>Camilla Andersen</navn>
      <fdato>1987-03-28</fdato>
      <fnr>28038760941</fnr>
      <medlem>false</medlem>
      <poeng>760.91</poeng>
      <hjemmeside>https://example.com/camilla-andersen</hjemmeside>
      <puljeId>2</puljeId>
   </person>
   <person>
      <id>d0012</id>
      <navn>Ida Berg</navn>
      <fdato>1991-04-17</fdato>
      <fnr>17049174162</fnr>
      <medlem>true</medlem>
      <poeng>980.44</poeng>
      <hjemmeside>https://example.com/ida-berg</hjemmeside>
      <puljeId>3</puljeId>
   </person>
   <person>
      <id>d0013</id>
      <navn>Emilie Larsen</navn>
      <fdato>1996-07-22</fdato>
      <fnr>22079680435</fnr>
      <medlem>false</medlem>
      <poeng>740.21</poeng>
      <hjemmeside>https://example.com/emilie-larsen</hjemmeside>
      <puljeId>4</puljeId>
   </person>
   <person>
      <id>d0014</id>
      <navn>Ragnhild Myklebust</navn>
      <fdato>1983-08-11</fdato>
      <fnr>11088343890</fnr>
      <medlem>true</medlem>
      <poeng>1015.32</poeng>
      <hjemmeside>https://example.com/ragnhild-myklebust</hjemmeside>
      <puljeId>2</puljeId>
   </person>
   <person>
      <id>d0015</id>
      <navn>Sara Holte</navn>
      <fdato>1989-09-09</fdato>
      <fnr>09098938157</fnr>
      <medlem>false</medlem>